,Word,Phrase
446,I changed my number so I need all my remainders to be sent to my new number is that possible,Not Found
447,Set a reminder for xrd slot on friday, xrd slot
448,Can u set a reminder for the 3rd of feb,Not Found
449,Jai jinendra Thnx shrdha ji for my today schedule,Not Found
450,Remind me to write the question paper in the morning, write the question paper
451,Who kept alarm at this time shardha, kept alarm
452,Hey Ples Remind me pop drawing and vanity drg At 1pm, drawing and vanity drg
453,Just remind me to collect books at 12 30, collect books
454,Remind me tomorrow to collect my marks cards , collect my marks cards
455,Another 2 alarms at 8 00am   8 20am also  Plz, another 1 alarms
456,I know very well about ur haptik how to use but when to use i will decide,Not Found
457,Remind tomorrow at 11 am about talking to bindu n shiv about the customer complaint , bindu n shiv about the customer complaint
458,make medic reminder at 11 30 am,Not Found
459,Set an alarm at 7 30 pm today ,Not Found
460,Remind me that I should get ready early tomorrow and go to temple in the morning, get ready go temple
461,Give me a call   8 pm , give me a call
462,Remind me to type report at 9 pm today, type report
463,Can you please adjust the schedule,Not Found
464,Remind me to deposit PPF amount at 3 pm today, deposit ppf amount
465,Plz remind me before every match,Not Found
466,Can u set this every day,Not Found
467,Hi,Not Found
468,Remind me to take puneet construction brief at 12pm, take puneet construction brief
469,Set reminder for insurance payment on 15th February, insurance payment
470,Remind me to go to bank today at 3 00 PM, go to bank
471,Can you change my reminders, my reminders
472,Remind me tommorow in morning about my summer training report file submission, my summer training report file submission
473,Remind me on 18th jan 2 atttend seminar dated 19th jan Thursday, seminar
474,Can you change the reminder time for tommorow s meeting to 9 30  ,Not Found
475,Remind me to buy Gehu today at 1pm, buy gehu
476,why havent uh called me up for my alarm, my alarm
477,Remind me to take my lab coat at tomorrow morning 8 am, take my lab coat
478,Set at 8 30,Not Found
479,  Agar Mujhe Pani Peene Ke Liye Koi reminder set karo,Not Found
480,Kindly reschedule the alarm for 7 am,Not Found
481,Thankyou for the reminder ,Not Found
482,Call to srinath at 2om, call srinath
483,Tmrw I go to church at 11 30 pm  Create a schedule,Not Found
484,Remind me on 13th Jan to meet mr Saboo next day, meet mr Saboo
485,Yeah can i pick up that call and will some one please say good morning mick have a nice day,Not Found
486,ILC remainder,Not Found
487,Can u remember me about to atten alluminai on 3 rd December 9 00 clock am, atten alluminai
488,Deactivate all my alarms and reminders , deactivate all my alarms and reminders
489,Set reminder at 6 pm tomorrow to go driving classes, go driving classes 1
490,Hi  there is a change in schedule , a change
491,Dish Tv recharge reminder set karna hai,Not Found
492,I wana set reminder,Not Found
493,Remind to pay 9009 to Vasanti textiles tomo at 12pm, pay 1111 to Vasanti textiles tomo
494,Remind me to take a cake home at 7pm today, take a cake home
495,khushboo could you remind me to eat every 2 5 hours starting from 8am today , eat
496,Oops need a reminder an hour bfr plz,Not Found
497,Can you please set me alarm,Not Found
498,Can you remind me today to wish tony stark a happy birthday, wish tony stark a happy birthday
499,Can you set reminder for my friend, my friend
